[
  {
    "requestId": "68962b6864fc7d6ff7266c1f",
    "userId": "a0687fe6dd5da634a58c1988",
    "accountId": "",
    "entityId": "9LKbWKhjDzuG5_pexnvyJF1hHL1R27VIDPwEIS95Zhhwbiuo6VZuL_AYOxPcpHsiLYf2jNscZgq1qeKwDGrivNpCmQ5WuNeNIJ_ZSgEg9khDBdrJFODtxbh-s41887fA",
    "errorCode": 0,
    "campaigns": []
  },
  {
    "requestId": "68962ba7cc14ec02f94b9611",
    "userId": "a0687fe6dd5da634a58c1988",
    "accountId": "",
    "entityId": "K4rsytVtReJ656phKFSWWFxedGzz40JnjTCMMTuwljcRX_mf3qt0gGHRKSr90BV2ZGB6oKHZVrTDPuRUgokegEh_1k4vPZoSz5-i0EbLpwdzXwBxfEQDnKRh4BQo5_D4",
    "errorCode": 0,
    "campaigns": [
      {
        "campaignId": "2fwcc",
        "campaignName": "Cart Confirm - Consented - Current",
        "campaignType": "ServerSide",
        "campaignJavascriptContent": null,
        "experienceId": "8GsXR",
        "experienceName": "Co-Buy + Similar Items",
        "experienceSourceCode": "",
        "state": "Published",
        "type": "ng",
        "userGroup": "Default",
        "templateNames": ["Static Rec Trays"],
        "payload": {
          "campaign": "2fwcc",
          "experience": "8GsXR",
          "fullProductIds": ["AN-45407437AD-000-015", "AN-100934744-000-015", "AN-4110972460095-000-015", "AN-98368624-000-015", "AN-4123957990005-000-015", "AN-100934777-000-015", "AN-93439776-000-015", "AN-4125972460005-000-015", "AN-4115912140003-000-015", "AN-95912424-000-015", "AN-98368608-000-015", "AN-4123652010053-000-015", "AN-96680376-000-015", "AN-4114556770051-000-015", "AN-4122971810001-000-015", "AN-4123957990008-000-015"],
          "itemType": "Product",
          "maxRatingBound": 5,
          "maximumNumberOfProducts": 16,
          "placement": {"displayPriority": 1, "label": "Cart Confirm", "placement": "cartConfirm"},
          "recsConfig": {"itemType": "Product", "itemTypeIsRestricted": true, "maxResults": 16, "maxResultsIsRestricted": true, "onPageAnchorId": null, "onPageAnchorType": null, "recipe": {"id": "ToECf", "label": "PDP - Co-Buy + Similar Items"}, "recipeId": null},
          "templateId": "staticRecTray",
          "userGroup": "Test"
        }
      },
      {
        "campaignId": "pnF4F",
        "campaignName": "PDP Bottom - Co-Buy - Consented",
        "campaignType": "ServerSide",
        "campaignJavascriptContent": null,
        "experienceId": "SaBj3",
        "experienceName": "PDP Bottom - Co-Buy",
        "experienceSourceCode": "",
        "state": "Published",
        "type": "ng",
        "userGroup": "Default",
        "templateNames": ["Static Rec Trays"],
        "payload": {
          "campaign": "pnF4F",
          "experience": "SaBj3",
          "fullProductIds": ["AN-4130647160153-000-560", "AN-86767662-000-025", "AN-4114086690121-000-069", "AN-99758856-000-010", "AN-4130652010091-000-256", "AN-4130942140004-000-060", "AN-68798297-000-069", "AN-67685065-000-006", "AN-4130646420009-000-256", "AN-82903097-000-060"],
          "itemType": "Product",
          "maxRatingBound": 5,
          "maximumNumberOfProducts": 10,
          "placement": {"displayPriority": 4, "label": "PDP: Bottom Tray", "placement": "pdpBottom"},
          "recsConfig": {"itemType": "Product", "itemTypeIsRestricted": true, "maxResults": 10, "maxResultsIsRestricted": true, "onPageAnchorId": null, "onPageAnchorType": null, "recipe": {"id": "QuPw1", "label": "Co-Buy Min Target 2 - IS Update 2"}, "recipeId": null},
          "templateId": "staticRecTray",
          "userGroup": "Test"
        }
      },
      {
        "campaignId": "vmcTE",
        "campaignName": "PDP Top - Consented - Current (Test)",
        "campaignType": "ServerSide",
        "campaignJavascriptContent": null,
        "experienceId": "3NPza",
        "experienceName": "Old Recipe",
        "experienceSourceCode": "",
        "state": "Published",
        "type": "ng",
        "userGroup": "Default",
        "templateNames": ["Static Rec Trays"],
        "payload": {
          "campaign": "vmcTE",
          "experience": "3NPza",
          "fullProductIds": ["AN-102520541-000-015", "AN-100892702-000-015", "AN-87389912-000-015", "AN-4114326950199-000-015", "AN-4114345140024-000-015", "AN-87570057-000-015", "AN-93752004-000-015", "AN-100908441-000-015", "AN-102374501-000-014", "AN-95925392-000-015", "AN-98054018-000-015", "AN-4139880890360-000-015", "AN-92699461-000-015", "AN-102374097-000-011", "AN-98563471-000-015", "AN-88303763-000-015"],
          "itemType": "Product",
          "maxRatingBound": 5,
          "maximumNumberOfProducts": 16,
          "placement": {"displayPriority": 3, "label": "PDP: Top Tray", "placement": "pdpTop"},
          "recsConfig": {"itemType": "Product", "itemTypeIsRestricted": true, "maxResults": 16, "maxResultsIsRestricted": true, "onPageAnchorId": null, "onPageAnchorType": null, "recipe": {"id": "2jCHh", "label": "PDP Top - Co-Browse + Collab Filtering - category + color boost"}, "recipeId": null},
          "templateId": "staticRecTray",
          "userGroup": "Test"
        }
      }
    ]
  },
  {
    "requestId": "68962be55835961fab82aa80",
    "userId": "a0687fe6dd5da634a58c1988",
    "accountId": "",
    "entityId": "xqhcdPhLt3oHBCpY9_-qG3jt49LhFYNoZ3K45BzHLcAJhquyq7ozKuBkzR1k2wyCY83VmD8PyH4QMhccCXLpN-P7OVdW14s5x6CyPpH0UAYhaPdIR8R30rdeVxEROAX4",
    "errorCode": 0,
    "campaigns": [
      {
        "campaignId": "KwZ6W",
        "campaignName": "Cart (AN Web) - Items Under $25 - Consented",
        "campaignType": "ServerSide",
        "campaignJavascriptContent": null,
        "experienceId": "3oIHf",
        "experienceName": "Our Favorites Under $25 (AN) - Consented",
        "experienceSourceCode": "",
        "state": "Published",
        "type": "ng",
        "userGroup": "Default",
        "templateNames": ["Static Rec Trays"],
        "payload": {
          "campaign": "KwZ6W",
          "experience": "3oIHf",
          "fullProductIds": ["AN-87664579-000-066", "AN-100610815-000-040", "AN-93260057-000-048", "AN-46288486-000-266", "AN-100177963-000-030", "AN-96994488-000-053", "AN-101955136-000-072", "AN-92032606-000-040", "AN-100808955-000-054", "AN-100679372-000-639", "AN-64001910-000-010", "AN-95908463-000-066", "AN-88447594-000-066", "AN-87245361-000-040", "AN-90789066-000-263", "AN-103250197-000-066"],
          "itemType": "Product",
          "maxRatingBound": 5,
          "maximumNumberOfProducts": 16,
          "placement": {"displayPriority": 1, "label": "Cart", "placement": "cart"},
          "recsConfig": {"itemType": "Product", "itemTypeIsRestricted": true, "maxResults": 16, "maxResultsIsRestricted": true, "onPageAnchorId": null, "onPageAnchorType": null, "recipe": {"id": "Durrp", "label": "Items Under $25"}, "recipeId": null},
          "templateId": "staticRecTray",
          "userGroup": "Test"
        }
      }
    ]
  },
  {
    "requestId": "68962c2edb59d338b66e0c14",
    "userId": "a0687fe6dd5da634a58c1988",
    "accountId": "",
    "entityId": "sd8NS9PeJO_bAYpjY2bme0xlPUcJU-u01-g5sxkhaaWLhD7zfiDYRhCiiJDhnMnCF_eo2ymLz2waz1mbTpEKGMc9PzqnjaJp_s-YfbHSIxYIwPA2emYnde5vv7Y6EwvI",
    "errorCode": 0,
    "campaigns": [
      {
        "campaignId": "mkyxD",
        "campaignName": "Homepage Tray 2 - Trending (Most Viewed) - Consented",
        "campaignType": "ServerSide",
        "campaignJavascriptContent": null,
        "experienceId": "qsau4",
        "experienceName": "Homepage Tray 2 - Trending (Most Viewed) - Consented",
        "experienceSourceCode": "",
        "state": "Published",
        "type": "ng",
        "userGroup": "Default",
        "templateNames": ["Dynamic Rec Trays"],
        "payload": {
          "campaign": "mkyxD",
          "displayPriority": 3,
          "dynamicPlacement": "hpg-tray-2",
          "experience": "qsau4",
          "fullProductIds": ["AN-4130647160153-000-560", "AN-86767662-000-025", "AN-4114086690121-000-069", "AN-99758856-000-010", "AN-4130652010091-000-256", "AN-68798297-000-069", "AN-4130942140004-000-060", "AN-67685065-000-006", "AN-4130646420009-000-256", "AN-82903097-000-060"],
          "maxRatingBound": 5,
          "maximumNumberOfProducts": 10,
          "placement": {"displayPriority": 3, "placement": "hpg-tray-2"},
          "recsConfig": {"itemType": "Product", "itemTypeIsRestricted": true, "maxResults": 10, "maxResultsIsRestricted": true, "onPageAnchorId": null, "onPageAnchorType": null, "recipe": {"id": "oFxtB", "label": "Homepage - Trending (most viewed)"}, "recipeId": null},
          "templateId": "dynamicRecTray",
          "userGroup": "Test"
        }
      },
      {
        "campaignId": "KbHsD",
        "campaignName": "Homepage Tray 1 - Collab Filtering - Consented",
        "campaignType": "ServerSide",
        "campaignJavascriptContent": null,
        "experienceId": "UmPY0",
        "experienceName": "Homepage Tray 1 - Collab Filtering - Consented",
        "experienceSourceCode": "",
        "state": "Published",
        "type": "ng",
        "userGroup": "Default",
        "templateNames": ["Dynamic Rec Trays"],
        "payload": {
          "campaign": "KbHsD",
          "displayPriority": 2,
          "dynamicPlacement": "hpg-tray-1",
          "experience": "UmPY0",
          "fullProductIds": ["AN-102303997-000-014", "AN-90746405-000-020", "AN-4112970080023-000-020", "AN-99575862-000-061", "AN-102393675-000-087", "AN-101442515-000-041", "AN-95467510-000-045", "AN-88303763-000-012", "AN-4110660650033-000-015", "AN-4115054590104-000-092"],
          "maxRatingBound": 5,
          "maximumNumberOfProducts": 10,
          "placement": {"displayPriority": 2, "placement": "hpg-tray-1"},
          "recsConfig": {"itemType": "Product", "itemTypeIsRestricted": true, "maxResults": 10, "maxResultsIsRestricted": true, "onPageAnchorId": null, "onPageAnchorType": null, "recipe": {"id": "kT3ew", "label": "Homepage - Collaborative Filtering"}, "recipeId": null},
          "templateId": "dynamicRecTray",
          "userGroup": "Test"
        }
      },
      {